1,Constantine gives everything the right intensity and seems to have a good understanding of the underlying psychological motivations.  
1,It is wonderful and inspiring to watch and I hope that it gets released again on to video or DVD.  
0,How this piece of trash was ever released is beyond me: the acting the story the characters the supposedly special effects etc...it's ALL wrong.  
0,In fact this stinker smells like a direct-to-video release.  
0,Avoid at ALL costs!  
0,Star Trek V The final Frontier is the worst in the series.  
0,The acting from all involved and that includes those like Shatner and Nimoy is bad and washed out and making them seem as old as they look in real life the special effects are tacky like when Spock has to rescue Kirk on a jet pack when he falls down from a mountain.  
0,The attempts at humor were pitiful and story is so awful it dosen't bear thinking about which basically involves a Vulcan stealing the Enterprise to find god (seriously) I just didn't care about any of this film and oh not to mention Uhura does a belly dance to distract male guards.  
0,The only place good for this film is in the garbage.  
0,The worst one of the series.  
1,Editing: The editing of this film was phenomenal in my opinion.  
1,When a song could explain the emotions of the subjects better such as when Jay Adams' unfortunate life was a subject of talk the song Old Man by Neil Young was played which evokes many emotions.  
1,Cinematography: The film was shot in an interesting way.  
1,Of course the footage from the 70s was grainy but that only enhanced the film.  
1,This film offers many delights and surprises.  
1,"When Achille and Philippa beautifully sing a duet from ""Don Giovanni"" that perfectly describes their situation in the movie you appreciate the subtle layers of this excellent film.  "
1,The story unfolds in 18th century Jutland and the use of period music played on period instruments is just one more fine touch.  
1,You share General Loewenhielm's exquisite joy in his partaking of the Cailles en Sarcophage even though you are just watching a movie - but you do wish for just a small sample to savor.  
1,But this understated film leaves a lasting impression.  
1,The warmth it generates is in contrast to its austere backdrop.  
1,You will leave the theater wanting to go out and dance under the stars.  
1,The acting as you'd expect from this cast is top notch.  
1,The characters are fleshed out surprisingly well particularly Grimes and Blake and all the actors deliver their sharply scripted lines with just the right amount of deadpan tongue in cheek to make the dialogue both hilarious and realistic.  
1,Angus Scrimm also turns in a good performance in a somewhat brief but memorable role as the gently menacing violin-playing anatomist Doctor Quinn.  
1,Conclusion - I loved it.  
1,It's a long time since I was so entertained by a movie.  
1,I struggle to find anything bad to say about it.  
1,Mark my words this is one of those cult films like Evil Dead 2 or Phantasm that people will still be discovering and falling in love with 20 30 40 years down the line.  
1,It's pretty surprising that this wonderful film was made in 1949 as Hollywood generally had its collective heads in the sand concerning black and white issues at that time.  
1,The film deserves strong kudos for taking this stand for having exceptional acting from its mostly lesser-known cast and for the super-intelligent script that doesn't insult the audience or take the easy way out when it comes to white racism.  
1,Plus with the movie's rather modest budget and fast running time it does an amazing job!  
1,Juano Hernandez (an exceptional actor who played supporting roles in many films of the era) is a proud black man who is accused of murdering a white man in the South.  
1,Trumbull on I LOVE LUCY).  
1,See it with your kids if you have a chance--it will open up some amazing dialog about how far race relations have come in the last 50 years.  
1,See both films if you can.  
1,"It was that year however that reminded us that Huston was still at the top of his game as evinced by his faithful adaptation of James Joyce's acclaimed novella ""The Dead.  "
1,Feelings thoughts...Gabriel's discomfort during the dance...all these intangibles leap to life and come within the viewer's grasp in Huston's portrayal.  
0,Very disappointed and wondered how it could be in the Oscar shortlist.  
0,It's very slow.  
0,Lot of holes in the plot: there's nothing about how he became the emperor; nothing about where he spend 20 years between his childhood and mature age.  
0,) Don't waste your time.  
0,End of Days is one of the worst big-budget action movies I've ever seen.  
0,He surely doesn't know how to make a coherent action movie from the screenwriter of Air Force One who was only obliged to write the script just for a big sum of money.  
0,This was one of the worst films i have ever seen.  
0,I'm still trying to get over how bad it was.  
1,This movie is possibly one of the most creative works of horror ever.  
1,It has everything you could want... suspense drama comedy confusing subplots native americans brain eating... If you're looking for the be-all end-all of brainsucking movies look no further.  
1," With great sound effects and impressive special effects I can't recommend this movie enough.  	"
1,Call me a nut but I think this is one of the best movies ever.  
1,Great character actors Telly Savalas and Peter Boyle.  
0,1 hour 54 minutes of sheer tedium melodrama and horrible acting a mess of a script and a sinking feeling of GOOD LORD WHAT WERE THEY THINKING?  
0,Lots of holes in the script.  
0,It's like a bad two hour TV movie.  
0,Now imagine that every single one of those decisions was made wrong.  
0,The dialogue is atrocious.  
0,The acting is beyond abysmal.  
0,Everything stinks.  
0,Trouble is the writing and directing make it impossible to establish those things that make a movie watchable like character story theme and so on.  
0,Worse there's an incredibly weak sub-plot thrown in that follows a little band of latter-day Mansonites as they go after a reporter who's working on a story on the anniversary of the killings.  
0,It's dumb and pointless and a complete waste of time.  
0,In short don't bother with this movie.  
1,I won't spoil it but the ending in pretty amazing.  
1,The best scene in the movie is at the end but I won't spoil it.  
1,If there was ever an indication of a writer and a director's ability to meld two highly volatile temperaments into a seamless union of creativity then this is it!  
1,The result is a powerhouse achievement made more timely now perhaps because of our culture's disturbing fascination with celebrity and it's distorted interpretations of fame.  
1,A film not easily forgotten.  
1,But Kevin Spacey is an excellent verbal tsunami as Buddy Ackerman  and totally believable because he is a great actor.  
1,The scripting of the subtle comedy is unmatched by any movie in recent years.  
1,The characters are interesting even if a bit predictable.  
1,Highly recommended for all ages although the younger set will probably not appreciate some of the more subtle references they will certainly appreciate one galley scene in particular!  
1,Great movie!  
0,Also the story and acting were weak.  
0,At around 4 pm I bought it at around 8pm I started to watch at around 8.15pm I fast forwarded the remaining film to see if there was anything left watchable for a human being with a brain... but there wasn't.  
0,Either way it sucks.  
0,The script is horrendously stupid.  
0,The story starts too fast with absolutely no suspense or build-up in the slightest.  
0,Everything Captain Howdy says is either laughable or just plain stupid.  
0,What the hell kind of crap is that?!  
0,Then there's the plot holes.  
0,You could drive a semi truck into these holes!  
1,Linda Cardellini is the only thing good in this film.  
1,She's poised and amazing.  
0,Dee Snider just plain sucks.  
0,He can't act (one of the least scary villains I have ever seen) he can't write (did he write this damn movie in his sleep?  
0,I was bored throughout the whole damn thing.  
0,The acting sucks the music sucks the script sucks the pacing sucks the special FX suck the directing sucks... basically this movie sucks.  
0,This film tries to be a serious and sophisticated thriller/horror flick and it fails miserably.  
0,This is probably one of the least effective and utterly unoriginal films I have ever seen in my entire life.  
0,A piece of cinematic garbage captured on celluloid.  
0,Avoid at any and all costs.  
0,At any rate this film stinks its not funny and Fulci should have stayed with giallo and supernatural zombie movies.  
0,Avoid this film at all costs.  
0,I don't know what happened in Season Five what a mess.  
0,The only consistent thread holding the series together were the amazing performances of Leni Parker and Anita LaSelva as the two Taelons in quiet idealogical conflict.  
0,Now this is a movie I really dislike.  
0,It's one of the most boring Horror movies from the 90's mainly because it starts slow and centers in a boring atmosphere.  
0,The puppets look really cheesy  not in a good way like in the Puppet Master 80's flicks.  
0,The story is lame not interesting and NEVER really explains the sinister origins of the puppets.  
0,There aren't death scenes like in previous movies and the f/x are terrible.  
0,I felt asleep the first time I watched it so I can recommend it for insomniacs.  
1,The fact is this film is a wonderful heartwarming tale about two people chasing their dreams.  
1,"The best part about ""Nurse Betty"" is it's unpredictability.  "
1,Director Neil LaBute uses brutal violence to seperate dreams from reality and along with the touching drama and hilarious comedy you can never tell what is going to happen next.  
0,Otherwise don't even waste your time on this.  
0,This one just fails to create any real suspense.  
0,As for the killer don't expect anything original or even remotely frightening.  
1,There is however some pretty good acting (at least for this type of film).  
0,I'm so sorry but I really can't recommend it to anyone.  
0,One of the most boringpointless movies I have ever seen.  
0,The secondary plot line is incomprehensible and its relation to the primary plot line is mystifying.  
0,Hated it.  
0,This is one of the worst Sandra Bullock movie since Speed 2 But not quite that bad.  
0,I don't understand how this garbage got on the shelves of the movie store it's not even a real movie!  
0,I highly doubt that anyone could ever like this trash.  
0,This is not movie-making.  
0,The acting is like watching wooden puppets moving around and reading from a book that's how bad it is.  
0,So I am here to warn you--DO NOT RENT THIS MOVIE it is the dumbest thing you have never seen!  
1,I saw this short film on HBO the other day and absolutely loved it.  
1,I didn't realize how wonderful the short really is until the last two scenes.  
1,Excellent short film.  
1,Hopefully the director James Cox can turn the short into a feature length film with the same cast or win us over with a whole new film.  
0,I agree with Jessica this movie is pretty bad.  
0,Characters are one-dimensional even the good guys and especially the bad guys.  
0,The story line is totally predictable.  
1,Not much dialogue not much music the whole film was shot as elaborately and aesthetically like a sculpture.  
0,I've seen soap operas more intelligent than this movie.  
0,Bad characters bad story and bad acting.  
0,Really awful.  
0,Not easy to watch.  
1,Funny clever hip - just like Pray's previous film Hype!  
1,It was a long time that i didn't see a so charismatic actor on screen.  
1,Paolo Sorrentino has written a wonderful story about loneliness and Tony has built one of the most unforgettable characters seen in movies in recent years.  
1,The movie is not completely perfect but 'Titta Di Girolamo' will stay with you for a long time after the vision of the movie.  
1,I rate this movie 9/10.  
1,I do not know if this was Emilio Estevez's directorial debut but the pacing the interplay and development of the characters as well as some clever camera work surrounding the character Estevez plays all suggest a natural eye.  
1,The interplay between Martin and Emilio contains the same wonderful chemistry we saw in Wall Street with Martin and Charlie.  
1,"Kathy Bates is wonderful in her characters subtle desperation and escapism; a variation on her character in ""At Play In The Fields Of The Lord"".  "
1,For readers who have already seen one of Miyazaki's films: he is still in top form and made another worthwhile experience.  
1,It never condescends all the characters have good genuine hearts and believable problems.  
1,The two main characters may be two of the most believable children I ever saw put on screen.  
1,They are so easy to love but even more easy to identify with.  
1,This movie is great--especially if you enjoy visual arts.  
1,The scenery that the two daughters paint and photograph are beautiful.  
1,The story is also both funny and poignant at times.  
1,"People who like European films and ""art movies"" will like this movie.  "
1,This is truly an art movie--it actually has a lot of art in it.  
1,Go rent it.  
1,However after finally watching this film I realized that not only had I had a closed mind to the brilliance it depicts I also found myself watching it over and over again.  
1,It's the one movie that never ceases to interest me simply because it keeps me alert as I try to attempt to decipher it's meanings.  
1,Brilliance indeed.  
1,But if you liked movies like The Matrix (and better yet their sequels) I think you'll appreciate the thought provoking mindblowing experience this film will give you.  
1,Think of the film being like a dream.  
1,Simply beautiful.  
1,Both Rickman and Stowe play their roles to the hilt in this tale of a childrens' book writer who-- maybe?-- has written a subversive tract.  
1,It's a gloriously fun fast paced and fairly accurate portrayal of the night of a raver.  
1,It presents a idyllic yet serious portrayal of the ups and downs of the characters lives.  
0,"Just whatever you do avoid ""Groove"" as its the antithesis of all that is good about Human Traffic.  "
0,It's too bad that everyone else involved didn't share Crowe's level of dedication to quality for if they did we'd have a far better film on our hands than this sub-par mess.  
0,The movie seemed a little slow at first.  
1,But it picked up speed and got right to the point.  
1,"It showed exactly how the government and the scientist argued for humanity and the reasons of the ""gadget"".  "
1,I enjoyed it.  
1,I have recommended it to friends.  
1,I was particularly pleased with the acting ability of Dwight Schultz.  
1,Both actors truly understand and become their particular character delivering a convincing sincere performance.  
1,Their on-screen chemistry critical to the entire film is genuine.  
1,The film's dialogue is natural real to life.  
1,The writer Gorman Bechard undoubtedly did his homework because all references are industry and character-age appropriate.  
1,The incredible soundtrack truly captures the essence of the film.  
1,Each track commands sentiment actually contributing to the scenes and characters.  
1,Definitely worth seeing it's the sort of thought provoking film that forces you to question your own threshold of loneliness.  
1,"Hayao Miyazaki's latest and eighth film for Studio Ghibili ""Gake No Ue No Ponyo"" (Ponyo on the Cliff by the Sea) is a wonderfully fun and imaginative look at childhood.  "
1,At a time when it seems that film animation has been dominated by Disney/Pixar's CGI masterpieces it is both refreshing and comforting to know that Miyazaki is still relying on traditional hand-drawn animation to tell his charming and enchanting stories.  
1,Enough can not be said of the remarkable animation in this film.  
1,The art style has the appearance of crayon/pencil drawings and is wonderfully colorful and fanciful.  
0,If you act in such a film you should be glad that you're gonna drift away from earth as far as possible!  
0,This one wants to surf on the small wave of space movies in 1998 (Deep Impact and Armageddon) and this one fails everywhere.  
0,If you haven't choked in your own vomit by the end (by all the cheap drama and worthless dialogue) you've must have bored yourself to death with this waste of time.  
1,Still it makes up for all of this with a super ending that depicts a great sea vessel being taken out by the mighty frost.  
1,Just consider the excellent story solid acting and look of the film as added bonuses.  
0,Instead we got a bore fest about a whiny spoiled brat babysitting.  
1,Then I watched it again two Sundays ago (March 20th 2005) and I began to really enjoy it and this time I taped the entire thing.  
1,It is a very well acted and done TV Movie.  
1,Judith Light is one of my favorite actresses and I think she does a superb job in this film!  
1,I keep watching it over and over.  
1,It's a sad movie but very good.  
1,If you have not seen this movie I definitely recommend it!  
1,She is as lovely as usual this cutie!  
1,Still it's quite interesting and entertaining to follow.  
1,;) Recommend with confidence!  
1,This movie is well-balanced with comedy and drama and I thoroughly enjoyed myself.  
1,It was a riot to see Hugo Weaving play a sex-obsessed gay real estate salesman who uses his clients' houses for his trysts with the flaming Darren (Tom Hollander).  
1,:) Anyway the plot flowed smoothly and the male-bonding scenes were a hoot.  
1,The opening sequence of this gem is a classic and the cat n mouse games that follow are a delight to watch.  
1,Fans of the genre will be in heaven.  
1,Lange had become a great actress.  
1,It looked like a wonderful story.  
0,I never walked out of a movie faster.  
0,I just got bored watching Jessice Lange take her clothes off!  
0,Unfortunately any virtue in this film's production work was lost on a regrettable script.  
0,In a word it is embarrassing.  
0,Exceptionally bad!  
0,All in all its an insult to one's intelligence and a huge waste of money.  
1,The bose noise cancelling is amazing which is very important for a NYC commuter.
1,This battery is an excellent bargain!
0,Defective crap.
0,I would have given no star if I was able.
1,I wear glasses and it fits fine with them.
0,The sound quality for the device is unacceptable.Unless you are in a really quiet area you almost hear nothing.
0,I would not recommend this item to anyone.
0,The holster that arrived did not match the photo in the ad.
1,great...no problems at all!.
0,As an earlier review noted plug in this charger and nothing happens.
1,This frog phone charm is adorable and very eye catching.
0,You never know if you pushed it hard enough or the right number of times for the function you want or not.
1,The sound is clear and the people I talk to on it are amazed at the quality too.
1,I got the aluminum case for my new Palm VX and it worked really well--it has protected my handheld perfectly so far.
1,very good product well made.
1,Mobile Phone Tools are a must have.
1,I am very impressed with the job that Motorola did on the sturdiness of this phone.
1,I received my orders well within the shipping timeframe everything was in good working order and overall I am very excited to have this source.
1,The phone is sturdy and waterproof.
0,I am not impressed with this and i would not recommend this item to anyone.
0,My only complaint is the standard sound volume is a little low even when turned up to 5(of 5)
1,Thanks again to Amazon for having the things I need for a good price!
1,I ended up sliding it on the edge of my pants or back pockets instead.
1,I had to go to a store and bought a new NOKIA phone which is working great.
1,Works great!.
0,REALLY UGLY.
0,horrible had to switch 3 times.
1,The noise shield is incrediable.
0,No real improvement.
1,Razr Battery - Good buy.
1,Keep up the good work Amazon!!
0,They refuse to refund or replace.
0,Unfortunately it's easy to accidentally activate them with the gentle-touch buttons if you accidentally touch the phone to your face while listening.
0,So I basically threw my money out the window for nothing.
1,Great case and price!
0,All it took was one drop from about 6 inches above the kitchen counter and it was cracked.I am not impressed and I am not laughing.
1,Bluetooth range is good - a few days ago I left my phone in the trunk got a call and carried the conversation without a hitch.
1,Small sleek impressive looking practical setup with ample storage in place.
1,The eargels channel the sound directly into your ear and seem to increase the sound volume and clarity.
0,none of the new ones have ever quite worked properly.
1,I am glad I purchased it.
0,I've missed numerous calls because of this reason.
0,Perhaps my phone is defective but people cannot hear me when I use this.
0,Don't buy this product.
0,sucked most of the stuff does not work with my phone.
1,No shifting no bubbling no peeling not even a scratch NOTHING!I couldn't be more happier with my new one for the Droid.
0,Worst software ever used.... If I could give this zero stars I would.
0,Trying to make a call on these is an exercise in frustration.
0,The case is a flimsy piece of plastic and has no front or side protection whatsoever.
1,I own a Jabra Earset and was very happy with it but the sound quality especially outgoing on this is better.
1,I love the camera it's really pretty good quality.
1,Thank you for such great service.
1,Its a total package.
1,The seller is very understanding and patient I would definitely buy from them again.
0,I give Wirefly 1 star.I will contact Cingular/AT&T; and inform them of this practice.
0,It's AGGRAVATING!
1,Great product for the price!.
1,I have purchased these for both family and friends and all enjoy their clarity and ease of use
1,Virgin Wireless rocks and so does this cheap little phone!
0,None of it works just don't buy it.
0,Muddy low quality sound and the casing around the wire's insert was poorly super glued and slid off.
0,Please dont waste your money.
1,All in all I'm quite satisfied with this purchase.
0,If you are looking for a good quality Motorola Headset keep looking this isn't it.
0,Yet Plantronincs continues to use the same flawed charger design.
0,Disapointing Results.
0,Cumbersome design.
1,Great it was new packaged nice works good no problems and it came in less time then I expected!!!!
1,Great Product.
0,It's A PIECE OF CRAP!
0,My experience was terrible..... This was my fourth bluetooth headset and while it was much more comfortable than my last Jabra (which I HATED!!!
1,This fixes all the problems.
0,Worst ever.
1,I am very happy
1,I've had no trouble accessing the Internet downloading ringtones or performing any of the functions.
0,"I can barely ever hear on it and am constantly saying ""what?"""
0,The battery life is highly unacceptable.
0,That company is a joke.
1,It does everything the description said it would.
0,Due to this happening on every call I was forced to stop using this headset.
1,It works great with a car charger especially if you cannot plug in two adapters at the same time.
0,Verizon tech support walked my through a few procedures none of which worked and I ended up having to do a hard re-set wiping out all my data.
0,Voice Quality Signal Strength Dropped Calls.
1,It plays louder than any other speaker of this size; the price is so low that most would think the quality is lacking however it's not.
1,Better than expected.
0,It feels poorly constructed the menus are difficult to navigate and the buttons are so recessed that it is difficult to push them.
1,Battery is holding up well.
0,Also difficult to put on.I'd recommend avoiding this product.
0,I only used it two days and it wasn't always easy to hear with.
0,I got the car charger and not even after a week the charger was broken...I went to plug it in and it started smoking.
0,Sprint - terrible customer service.
1,Linked to my phone without effort.
1,THey are so cool!
1,Easy to use.
1,Better Than New.
0,What possesed me to get this junk I have no idea...
0,Piece of trash.
1,A pretty good product.
1,This is a great phone!.
1,For the price on Amazon it is an excellent product which I would highly recommend.
1,Their Research and Development division obviously knows what they're doing.
0,The real killer is the volume and of course it breaking.
1,Those phones are working just fine now.
1,I am more than happy with this product.
0,Poor Construction.
0,This is infuriating.
1,Overall I would recommend this phone over the new Walkman.
0,Sprint charges for this service.
0,It is cheap and it feel and look just as cheap.
1,It fits my ear well and is comfortable on.
0,It doesn't work in Europe or Asia.
1,clipping this to your belt will deffinitely make you feel like 50 cent's up-and-coming.
1,I like design and look of Jabra behing the ear headsets and 5020 is pretty comfortible to wear 24 hours a day without pain in the ear.
1,I was amazed at the quick arrival of the two original lg cell phone batteries and and at a fraction of the price.
0,the worst phone from samsung...crap..... this crappy Samsung E715.. is the worst i have ever seeen.
0,the charger worked for about a week and then completely stopped charging my phone.
0,Poor product.
0,However I needed some better instructions.
0,You need two hands to operate the screen.This software interface is decade old and cannot compete with new software designs.
