1,Worked very well paired with a Treo 700w and as a Skype headset on my PC (using a USB Bluetooth transceiver).
0,Steer clear of this product and go with the genuine Palm replacementr pens which come in a three-pack.
0,DO NOT BUY DO NOT BUYIT SUCKS
1,This is a great product..... sure beats using your fingers!.
0,Plus I seriously do not believe it is worth its steep price point.
1,All the other cases I've tried normally fall apart after a few months but this one seems to be in for the long haul.
0,Very Dissapointing Performance.
0,Don't make the same mistake that I did and please don't buy this phone.
0,This phone might well be the worst I've ever had in any brand.
0,Case was more or less an extra that I originally put on but later discarded because it scratched my ear.
1,I recommend iGo to anyone with different brand cell phones/mp3 players in the family.
0,Don't bother - go to the store.
1,I posted more detailed comments under the grey or black phone but i have the Fire Red and it's a great color!
1,I did not have any problem with this item and would order it again if needed.
0,You get what you pay for I guess.
1,Not only did the software do a great job of this I could also make my own ringtones form my existing CDs without an internet connection.
1,im surprised this is a good quality car charger and there's not much reviews about it.
1,These are fabulous!
0,However BT headsets are currently not good for real time games like first-person shooters since the audio delay messes me up.
1,I used bitpim (a free program you can find on the internet)to transfer data to the phone.The price of the cable was excellent.
0,Disappointing accessory from a good manufacturer.
0,Performed awful -- muffled tinny incoming sound and severe echo for those on the other end of the call.
1,Very wind-resistant.
0,Obviously they have a terrible customer service so you get what you pay for.
1,They do not last forever but is not overly expensive to replace.Easy to operate and the sound is much better than others I have tried.
0,I contacted the company and they told me that although the unit was still under warranty if I couldn't produce my receipt I was out of luck.
0,Linksys should have some way to exchange a bad phone for a refurb unit or something!
1,Phone is sturdy as all nokia bar phones are.
1,Great phone.
0,When I placed my treo into the case not only was it NOT snug but there was A LOT of extra room on the sides.
1,I'm pleased.
0,Battery is terrible.
1,I found the product to be easy to set up and use.
0,The earpiece on this is too large or too heavy...it keeps falling out of my ear.
0,Utter crap.. Sound quality is TERRIBLE.
0,The charger arrived within the promised timeframe but it did not work.
1,No ear loop needed it's tiny and the sound is great.
0,Finally after three or four times the spring of the latch broke and I could not use it any longer on the visor.
1,The handsfree part works fine but then the car tries to download the address book and the Treo reboots.Overall I still rate this device high.
0,Talk about USELESS customer service.
0,"It felt too light and ""tinny.""."
0,This does not fit the Palm Tungsten E2 and it broke the first time I tried to plug it in.
1,I'm happy about this purchase- good quality and low price.
1,I love the look and feel of Samsung flipphones.
1,Its well-designed and very sharp -- the blue is a very nice color.
1,Does everything it should and more.
0,I could not recommend these more.
1,Nice Sound.
0,Looks good in the picture but this case was a huge disappointment!!
1,Much less than the jawbone I was going to replace it with.
1,Setup went very smoothly.
0,its extremely slow and takes forever to do anything with it.
0,"A must study for anyone interested in the ""worst sins"" of industrial design."
0,The first thing that happened was that the tracking was off.
1,It is well made easy to access the phone and has a handy detachable belt clip.
0,Then I had to continue pairing it periodically since it somehow kept dropping.
0,Can't upload ringtones from a third party.
0,Bluetooth does not work phone locks up screens just flash up and now it just makes calls randomly while in my pocket locked.
0,Truly awful.
1,It works fine on my Motorola 325 cellphone and a lot better than the worn-out battery did.
1,The volume for the ringer is REAL good (you have choices how loud).
0,And none of the tones is acceptable.
0,camera color balance is AWFUL.
0,This product is clearly not ready for prime time I don't care how cool it looks if you can't tell a call is coming in it's worthless.
1,I love the ringtones because they are so upbeat!
0,Chinese Forgeries Abound!.
1,Easy to pair with my Samsung Cell.
0,The instructions didn't explain that a microphone jack could be used.
0,i would advise to not purchase this item it never worked very well.
0,Too bad you have to pay up to $$$ a month for the service!
1,Works well.
0,The nokia CA-42 USB cable did not work with my phone.
1,Clear crisp sound.
1,I have to use the smallest earpieces provided but it stays on pretty well.
0,The biggest complaint I have is the battery drains superfast.
0,The design might be ergonomic in theory but I could not stand having these in my ear.
0,Do NOT buy if you want to use the holster.
1,The phone can also take great pictures and even video clips.
0,It doesn't make you look cool.
1,Because both ears are occupied background is not distracting at all.
1,Comfortable fit - you need your headset to be comfortable for at least an hour at a time if not for an entire day.
0,Also the phone doesn't seem to accept anything except CBR mp3s preferably ripped by Windows Media Player.
1,You can't beat the price on these.
1,* Comes with a strong light that you can use to light up your camera shots and even flash SOS signals (seriously!
1,lightweight and works well.
0,So just beware.
1,I love this cable - it allows me to connect any mini-USB device to my PC.
0,So anyone near you will hear part of your conversation.
1,This is cool because most cases are just open there allowing the screen to get all scratched up.
0,I bought this phone as a replacement for my StarTac and have regretted it since.
1,Appears to actually outperform the original battery from China that came with my V325i.
0,Can't store anything but phone numbers to SIM.
0,It lasts less than 3o minutes if I actually try to use the phone.My wife has the same phone with the same problem.
0,Poor quality.
1,"jabra ear gels ""R"" the best!."
0,Not worth it.
0,The phone crashed completely and now I have to get it replaced.
1,It quit working after I'd used it for about 18 months so I just purchased another one because this is the best headset I've ever owned.
0,Unfortunately it will not recharge my iPhone 4s despite connecting it from multiple power sources (iMac external battery wall outlet etc).
1,It was a great phone.
0,if you simply want a small flip phone -- look elsewhere as the extra bells & whistles are mediocre.
1,Good value works fine - power via USB car or wall outlet.
1,My phone doesn't slide around my car now and the grip prevents my phone from slipping out of my hand.
1,This is simply the BEST bluetooth headset for sound quality!
0,Think it over when you plan to own this one!This sure is the last MOTO phone for me!
1,"In the span of an hour I had two people exclaim ""Whoa - is that the new phone on TV?!?"
1,I have always used corded headsets and the freedom from the wireless is very helpful.
1,This case has passed the one year mark and while it shows signs of wear it is 100% functional.
1,Other than that the leather is nice and soft; the fit is very tight; the cut out for the face is a good shape.
1,It has everything I need and I couldn't ask for more.
0,After receiving and using the product for just 2 days it broke.
1,This product is great... it makes working a lot easier I can go to the copier while waiting on hold for something.
0,None of the three sizes they sent with the headset would stay in my ears.
1,T-Mobile has the best customer service anywhere.
1,Arrived quickly and much less expensive than others being sold.
0,We have tried 2 units and they both failed within 2 months.. Pros
1,Provides good protection and looks classy too.
1,Krussel Always good.
1,The tracfonewebsite is user friendly and makes it easy toactivate etc.
1,The design is very good.4.
1,I great reception all the time.
1,I would highly recommend this product.
0,Couldn't use the unit with sunglasses not good in Texas!
0,It dit not work most of the time with my Nokia 5320.
0,Bought mainly for the charger which broke soon after purchasing.
0,If you like a loud buzzing to override all your conversations then this phone is for you!
1,Fantastic buy and will get again for whatever my next phone is
0,stay away from this store be careful.
1,This BlueAnt Supertooth hands-free phone speaker is AWESOME.
0,Does not fit.
1,.... Item arrived quickly and works great with my Metro PCS Samsung SCH-r450 slider phone and Sony Premium Sound in ear plugs.
1,It is light has plenty of battery capacity and is very confortable to wear for somewhat extended periods of time.
0,disappointing.
1,Blue Ant is easy to use.
1,Cheap but hey it works.. Was pleasantly suprised given the low cost of this item.
0,The camera on the phone may be used as a dustpan when indoors... I'd rather be using a disposable then this.
0,Then a few days later the a puff of smoke came out of the phone while in use.
1,It's very convenient and simple to use - gets job done & makes the car ride so much smoother.
0,The nano stated it.My son was dissapointed.
1,The sound quality is excellent as well.
1,Its the best headset I have used.
0,Would not reccommend.
1,They have been around for years and carries the highest quality of anti-glare screen protector that I have found to date.
1,Just what I wanted.
0,This particular model would not work with my Motorola Q smartphone.
0,wont work right or atleast for me.
0,in addition it feels &amp; looks as if the phone is all lightweight cheap plastic.
0,"But now that it is ""out of warranty"" the same problems reoccure.Bottom line... put your money somewhere else... Cingular will not support it."
0,I really wanted the Plantronics 510 to be the right one but it has too many issues for me.The good
1,Great product.
1,Crisp and Clear.
0,AFter the first charge kept going dead after 12 minutes.
0,VERY cheap plastic creaks like an old wooden floor.
0,I get absolutely horrible reception in my apartment where with other phones I have not had this problem.
1,The reception has been generally good.
1,Excellent sound battery life and inconspicuous to boot!.
1,Great bluetooth!.
1,I highly recommend this case.
1,WORTHWHILE.
1,This is a great deal.
0,After my phone got to be about a year old it's been slowly breaking despite much care on my part.
0,I am sorry I made this purchase.
0,I bought these hoping I could make my Bluetooth headset fit better but these things made it impossible to wear.
0,Treo and T-Mobile refused to replace it again and forced me to buy another phone without any kind of upgrade discount.
0,It was horrible!.
0,I don't think it would hold it too securly on your belt.
0,This allows the possibility of double booking for the same date and time after the first.
0,They work about 2 weeks then break.
1,It is simple to use and I like it.
1,It's a great tool for entertainment communication and data management.Oh be sure to use ActiveSync 4.2 for optimal data synchronization results!
0,I can't use this case because the smell is disgusting.
0,NOT WHAT I WANTED.
1,I own 2 of these cases and would order another.
1,Great Phone.
1,I bought this battery with a coupon from Amazon and I'm very happy with my purchase.
0,The internet access was fine it the rare instance that it worked.
1,Perfect for the PS3.
1,Five star Plus plus.
1,A good quality bargain.. I bought this after I bought a cheapy from Big Lots that sounded awful and people on the other end couldn't hear me.
0,$50 Down the drain.
0,I tried talking real loud but shouting on the telephone gets old and I was still told it wasn't great.
1,Good  works fine.
1,For the price this was a great deal.
1,Great price too!
0,If there is a wind it is completely useless.
1,Yes it's shiny on front side - and I love it!
0,Does Not Work.
0,At first I thought I was grtting a good deal at $7.44 until I plugged it into my phone (V3c Razr).
1,The reception through this headset is excellent.
1,2 thumbs up to this seller
1,I have a Verizon LG phone and they work well together good reception and range that exceeds 20 feet line of sight.
0,Improper description.... I had to return it.
1,#1 It Works - #2 It is Comfortable.
1,Battery charge-life is quite long.
1,The Jabra EarGels fit my ears very well.
0,Battery has no life.
0,I checked everywhere and there is no feature for it which is really disappointing.
1,Product is exactly as described.
1,Gets a signal when other Verizon phones won't.
0,Doesn't do the job.
1,I would recommend it.
1,Plan on ordering from them again and again.
1,That being said for a phone the camera is very nice; many cool effects to play with and video is decent as well.
1,I have been very satisfied with this cell phone from day one.
1,They keep getting better and better (this is my third one and I've had numerous Palms too).
0,Awkward to use and unreliable.
1,The shipping time was also very quick!
0,Not as good as I had hoped.
1,Good case!.
0,Doesn't Work.
1,Really good product.
0,Unfortunately it did not work.
0,All three broke within two months of use.
0,dont buy it.
0,My father has the V265 and the battery is dying.
0,However the ear pads come off easily and after only one week I lost one.
0,The calls drop the phone comes on and off at will the screen goes black and the worst of all it stops ringing intermittently.
0,Horrible horrible protector.
0,I don't like this Nokia either.
0,Reaching for the bottom row is uncomfortable and the send and end keys are not where I expect them to be.3.
0,I have bought this Nokia cell phone a few weeks ago and it was a nightmare.
0,It would take too long to describe how bad my customer service experience has been with Amazon.
0,the only VERY DISAPPOINTING thing was there was NO SPEAKERPHONE!!!!
0,Terrible.. My car will not accept this cassette.
0,Product is useless since it does not have enough charging current to charge the 2 cellphones I was planning to use it with.
0,It's not what it says it is.
0,Stay Away From the Q!.
0,Used and dirty.
0,Very unreliable service from T-mobile !
0,Not good enough for the price.
0,I bought two of them and neither will charge.
1,It looks very nice.
1,This is an excellent tool especially when paired with your phone's auto-answer.
1,I have read other's reviews here but I haven't had any problem with it.
0,These products cover up the important light sensor above the ear outlet.
1,Comfortable in my hand.
0,Just does not work.
0,Poor Reliability.
1,(It works!)
0,If I take a picture the battery drops a bar and starts beeping letting me know its dieing.
0,Terrible product and waste of money!
0,Last time buying from you.
0,It was a waste of my money.
1,So far it has worked like a charm.
1,I have only had it for a few weeks but so far so good.
1,But in any case the best part is you can download these pictures to your laptop using IR or even send pictures from your laptop to the phone.
1,Would recommend this item.
1,It's been my choice headset for years.Great sound; good volume; good noise cancellation.
1,Nice case feels good in your hands.
0,The item received was Counterfeit.
1,Just really good.. So far probably the best BT headset I have ever had.
1,Works fine.
1,I received my headset in good time and was happy with it.
1,I was very pleased to see that I could replace my well travled swivel holster for my Blackberry flip.
1,My sister has one also and she loves it.
1,Good Quality.
0,This is by far the worst purchase I've made on Amazon.
1,Excellent dual-purpose headset.
1,Excellent!.
0,Does not work for listening to music with the cingular 8125.
1,It seems completely secure both holding on to my belt and keeping the iPhone inside.
0,The bottowm line...another worthless cheap gimmick from Sprint.
0,Having trouble with volume.
1,The only good thing was that it fits comfortably on small ears.
0,WARNING - DO NOT BUY!!.
1,I am pairing this with my iphone and I could not be happier with it so far.
0,When it opens the battery connection is broken and the device is turned off.
0,I didn't want the clip going over the top of my ear causing discomfort.
1,Best headset ever!!!.
0,Don't trust their website and don't expect any helpful support.
1,It was that loud.Glad to say that the Plantronics 510 maintains a flawless connection to my cell and with no static during normal use.
0,The speaker is of low quality so as making the ring tones sound very cheap.
1,Fits comfortably came with three sizes of earbud tips.
1,Excellent product for the price.
0,Bad Reception.
0,This product is very High quality Chinese CRAP!!!!!!
1,It was quite comfortable in the ear.
1,Great phone.
0,Don't buy this product - It fails!.
0,Everything about this product is wrong.First
1,The pairing of the two devices was so easy it barely took a couple minutes before I started making calls with the voice dialing feature.
0,This was utterly confusing at first which caused me to lose a couple of very very important contacts.
0,Terrible phone holder.
1,The cutouts and buttons are placed perfectly.
1,I love being able to use one headset for both by land-line and cell.
0,Problem is that the ear loops are made of weak material and break easily.
0,Not nearly as good looking as the AMAZON picture makes it look.
1,But despite these few flaws this case is of exceptional quality and well worth the additional costs of owning an official OEM product.
0,How stupid is that?
1,I can hear while I'm driving in the car and usually don't even have to put it on it's loudest setting.
1,Seller shipped quickly and much cheaper than the competitors.
1,Good show Samsung.
1,So I bought about 10 of these and saved alot of money.
0,It always cuts out and makes a beep beep beep sound then says signal failed.
0,Couldn't figure it out
0,My phone sounded OK ( not great - OK) but my wife's phone was almost totally unintelligible she couldn't understand a word being said on it.
0,So I had to take the battery out of the phone put it all back together and then restart it.
0,While I managed to bend the leaf spring back in place the metal now has enough stress that it will break on the next drop.
1,Leopard Print is wonderfully wild!.
1,Works for me.
0,Saggy floppy piece of junk.
1,much better than the hard plastic cases.
0,It also had a new problem.
1,Happy so far!.
1,cool phone.
1,Works good.
1,Motorola finally got the voice quality of a bluetooth headset right.
0,It looses connection to the phone even when it is within a couple feet between the two.
1,but it is great i would really recommend it
0,Makes it easier to keep up with my bluetooth when I'm not wearing it.
0,As I said above....PRETTY USELESS!
0,Never got it!!!!!
0,This pair of headphones is the worst that I have ever had sound-wise.
0,[...] down the drain because of a weak snap!
0,Does not charge the Cingular (ATT) 8525 phone.
1,"You get extra minutes so that you can carry out the call and not get cut off."""
0,However after about a year the fliptop started to get loose and wobbly and eventually my screen went black and I couldn't receive and place calls.
0,I kept catching the cable on the seat and I had to pull the phone out to turn it on an off.
1,The headset fulfills my requirements so I am happy with my purchase.
1,Logitech Bluetooth Headset is a 10!.
1,I like the fact that it rests lightly against your ear rather than inside.
1,A lot of websites have been rating this a very good phone and so do I.
1,I have tried these cables with my computer and my iPod and it works just fine.
0,The mic there is a joke and the volume is quite low.
0,I'm returning them.
0,I does not maintain a connection with the computer while it is on my lap.
1,It is easy to turn on and off when you are in the car and the volume controls are quite accessable.
1,I have had mine for about a year and this Christmas I bought some for the rest of the family.
1,Otherwise easy to install and use clear sound.
1,nice leather.
0,I had to purchase a different case.
1,It is a joy to use.
0,Very much disappointed with this company.
1,Very satisifed with that.
0,It didn't charge for me.
1,This is the phone to get for 2005.... I just bought my S710a and all I can say is WOW!
0,Buttons are too small.
1,Just reading on the specs alone makes you say WOW.
1,Love it.. Great armband.
1,I really like this product over the Motorola because it is allot clearer on the ear piece and the mic.
0,However the keypads are so tinny that I sometimes reach the wrong buttons.
1,I exchanged the sony ericson z500a for this and I'm pretty happy with that decision.
1,I was very impressed with the price of the cases.
1,Also makes it easier to hold on to.
1,I use this product in a motor control center where there is a lot of high voltage humming from the equipment and it works great!
1,It's pretty easy.
0,I cannot make calls at certain places.
0,however my girl was complain that some time the phone doesn't wake up like normal phone does.
1,Beautiful styling though.
0,This company charge me a restocking fee and still not given me my refund back.
0,I'm trying to return it for a refund.
0,I plugged it in only to find out not a darn thing worked.
1,Excellent product.
0,Earbud piece breaks easily.
0,Lousy product.
0,This phone tries very hard to do everything but fails at it's very ability to be a phone.
1,It is the best charger I have seen on the market yet.
1,SWEETEST PHONE!!!
1,:-)Oh the charger seems to work fine.
1,It fits so securely that the ear hook does not even need to be used and the sound is better directed through your ear canal.
0,Not enough volume.
0,Echo Problem....Very unsatisfactory
0,you could only take 2 videos at a time and the quality was very poor.
0,don't waste your money.
0,I am going to have to be the first to negatively review this product.
0,Adapter does not provide enough charging current.
0,There was so much hype over this phone that I assumed it was the best my mistake.
0,You also cannot take pictures with it in the case because the lense is covered.
0,Phone falls out easily.
0,It didn't work people can not hear me when I talk.
0,The text messaging feature is really tricky to use.
0,I'm really disappointed all I have now is a charger that doesn't work.
0,Painful on the ear.
0,Lasted one day and then blew up.
0,disappointed.
0,Kind of flops around.
0,The screen does get smudged easily because it touches your ear and face.
0,What a piece of junk.. I lose more calls on this phone.
0,Item Does Not Match Picture.
0,The only thing that disappoint me is the infra red port (irda).
0,You can not answer calls with the unit never worked once!
1,I love you
