1,The entire audience applauded at the conclusion of the film.  
1,I left the theater with a lilt in my step joy in my heart and hope for the human race.  
1,Duris has a wholesome appearance and gives a fine performance.  
1,The rest of the cast also play well.  
1,Cinematography noteworthy including fine views of Barcelona and its famed Gaudi towers.  
0,About ten minutes into this film I started having second thoughts.  
0,About half way through this film I started to dislike it.  
0,By the time the film ended I not only disliked it I despised it.  
0,What this film lacks is a convincing script.  
0,The script looks as if only a rough draft was written and shooting began before a finished script was completed.  
0,Things happen characters personalities change plot twists occur for no real reason other than that script calls for it.  
1,The cast is good.  
1,For that it's worth checking out.  
0,This is probably the most irritating show I have ever seen in my entire life.  
0,It is indescribably the most annoying and idiotic show I have ever seen.  
0,Everything about it is just bad.  
0,I could not understand what kind of idiot would produce this mess in the first place not to mention several season.  
0,The script is bad very bad  it contains both cheesiness and unethical joke that you normally see in rated R or NC-17 movie.  
0,The casting is also horrible cause all you see is a really really BAD Actors period.  
0,Final Word: This Show is a real torture!!  
0,It is zillion times away from reality.  
0,Watching washing machine twirling around wouldn't hurt your eyes as much as this show.  
0,Rating: 0/10 (Grade: Z) Note: The Show Is So Bad That Even Mother Of The Cast Pull Her Daughter Out Of The Show.  
0,20th Century Fox's ROAD HOUSE 1948) is not only quite a silly noir but is an implausible unmitigated bore of a movie.  
0,Full of unconvincing cardboard characters it is blandly written by Edward Chodorov who also produced and is surprisingly directed by Jean Negulesco from whom one would expect a great deal more.  
0,From here on the Widmark character turns unintentionally comical!  
0,His losing his marbles so early in the proceedings is totally implausible and unconvincing.  
0,And if that isn't enough of a mess of a movie for you - the picture is also marred with a constant use of studio sets and indoor exteriors.  
0,Whatever prompted such a documentary is beyond me!  
0,(very serious spoilers) this movie was a huge disappointment.  
0,there are so many problems i dont know where to start.  
1,the cast was great.  
1,steve martin delivers a really funny performance of a middle-aged upper class uptight white guy.  
1,add betty white and jean smart and you have a great cast - everyone played their parts really well.  
0,but the movie makes a lot of serious mistakes.  
0,first of all there are enough racial stereotypes and racial jokes to offend everyone.  
0,the movie is littered with overt racial slurs towards the black cast members and in return the whites are depicted as morons and boobs.  
0,putting the race card aside lets look at the major flaw in the film: they destroy latifa's character.  
0,there is no real plot.  
0,i wouldnt see this movie again for free.  
1,STEAMBOAT WILLIE is an amazingly important film to our cinema history.  
1,This second appearance of Mickey Mouse (following the silent PLANE CRAZY earlier that year) is probably his most famous film--mostly because it was so ground-breaking.  
1,While you don't yet hear Mickey speak there are tons of sound effects and music throughout the film--something we take for granted now but which was a huge crowd pleaser in 1928.  
1,However after seeing the short again after about 25 years I was amazed at how timeless the film actually is.  
1,"It's just adorable seeing Mickey playing ""Turkey in the Straw"" in a highly imaginative (if occasionally cruel) way.  "
1,Clever and a real crowd-pleaser--this film still ranks among Mickey's best films even after 80 wonderful years.  
0,The bipolarity of the ruthless thug (one minute a ruthless killer the next minute a Luv's diaper commercial) is completely unconvincing.  
0,I'm terribly disappointed that this film would receive so many awards and accolades especially when there are far more deserving works of film out there.  
1,The original Body and Soul (1947) is a masterpiece.  
1,John Garfield Ann revere Lilli Plmer William Conrad Canada Lee...and filmed by one of the greatest cinematographers to ever grace the screen..James Wong Howe.  
0,I don't think there are any redeeming qualities in this remake.  
0,This may be the only bad film he ever made.  
0,So bad...well...it's just bad.  
0,This movie is a solid example of a bad plot and a very very bad idea all the way.  
0,It's a shame to see good actors like Thomerson and James make a living in a mess like this.  
0,I thought it was bad.  
0,Both films are terrible but to the credit of the 1986 version it was watchable.  
0,Let's start with all the problemsthe acting especially from the lead professor was very very bad.  
0,The script is a big flawed mess.  
0,The best example of how dumb the writing is when it's established that you can turn the zombie-students back into humans by removing a necklace containing a piece of the meteorite.  
0,"Director Paul Matthews who also wrote/directed the weak 1995 monster movie ""Grim"" clearly doesn't know how to pace his films.  "
0,The movie is terribly boring in places.  
0,The lighting is awful.  
0,The film looks cheap and bland.  
0,One of the most disappointing aspects is the lack of notable gore.  
0,This convention never worked well in the past and certainly doesn't work here.  
0,The visual effects were AWFUL.  
0,The CG opening sequence in space looked like it could have been created on Microsoft Slideshow for God's sake!  
0,"The ""explosion"" of the Gas tanks at the end was just as awful.  "
1,Okay I like to consider myself a fair critic so I'll give credit where credit's due--the creature effects were actually pretty cool.  
1,Gotta love those close-ups of slimy drooling teeth!  
0,"To sum the film up ""Breeders"" is a terrible cheaply made horror movie that should be avoided like the Ebola virus.  "
0,Not recommended.  
0,He is almost unbearable to watch on screen he has little to no charisma and terrible comedic timing.  
0,Aside from it's terrible lead this film has loads of other debits.  
0,I understand that it's supposed to be a cheap popcorn comedy but that doesn't mean that it has to completely insult our intelligence and have writing so incredibly hackneyed that it borders on offensive.  
0,Lewis Black's considerable talent is wasted here too as he is at his most incendiary when he is unrestrained which the PG-13 rating certainly won't allow.  
1,The film's sole bright spot was Jonah Hill (who will look almost unrecognizable to fans of the recent Superbad due to the amount of weight he lost in the interim).  
0,With the originality and freshness of the first movie now spent this remake had little else to offer.  
0,The budget was evidently very limited.  
0,This was reflected not only in the cast but also in the below-par script which borrowed much from the earlier classic.  
0,However here there was no decent acting action or location work to balance things up.  
0,Filmiing was less expansive.  
0,It failed to convey the broad sweep of landscapes that were a great part of the original.  
0,Generally; it just lacked imagination.  
0,Not recommended.  
0,Is it possible for a movie to get any worse than this?  
0,There is no plot here to keep you going in the first place.  
0,Even when the women finally show up there is no sign of improvement; the most expected things happen and by the time the film is over you might be far asleep.  
0,Beware: this is not a trashy cult movie this is trash -period!  
0,I can't believe there's even a sequel to this!  
0,Which is precisely why I am giving it such a bad review!  
1,Being a 90's child I truly enjoyed this show and I can proudly say that I enjoyed it big time and even more than the classical WB cartoons.  
1,"But ""Tiny Toons"" kept the 90's vibe and delivered one of the most popular funny and underrated cartoons ever created.  "
1,The memories are murky but I can only say that I enjoyed every single episode and product related to the show.  
1,Easily none other cartoon made me laugh in a tender way (before getting into dark sitcoms oriented for teenagers).  
1,The characters were all funny and had the peculiarity of not having a true lead character.  
1,Every single character was hilarious and deserved to be called a lead.  
0,Every element of this story was so over the top excessively phony and contrived that it was painful to sit through.  
0,Her lines seem to have been WRITTEN by a fifteen year old though they are trying oh so so hard to sound like how a fifteen year old would really um you know well... talk.  
1,Perabo has a nice energy level and is obviously very comfortable in front of a camera.  
0,There is simply no excuse for something this poorly done.  
0,I saw this movie and I thought this is a stupid movie.  
0,What is even more stupid is that who had thought an idea that there should be a volcano in Los Angeles?  
0,To be honest with you this is unbelievable nonsense and very foolish.  
0,In conclusion I will not bother with this movie because a volcano in Los Angeles is nothing but nonsense.  
0,The story line is just awful!  
0,It's just painful!  
0,And the accents are absolutely abysmal!  
0,There's also enough hypocrisy in this film to make me vomit.  
0,Don't waste your time watching this rubbish non-researched film.  
1,I believe that Pitch Black was done well.  
1,The characters are interesting and you want to find out more about them the longer the movie goes on and I think people will be surprised by who does and doesn't make it.  
1,Go watch it!  
0,Omit watching this.  
1,VERY funny!  
0,My rating: just 3 out of 10.  
1,The characters are interesting and you really care for them.  
1,An instant classic with a great soundtrack and a catchy song during the ending credits.  
1,Don't miss it.  
1,This is a masterful piece of film-making with many themes simmering and occasionally boiling over in this warts and all study of the poet's bohemian self-indulgent wartime years that span the aerial bombardments of London and the outward tranquillity of a Welsh coastal retreat - the borderlines between friendship lust and love dedication to art and experience versus practical concerns jealousy rivalry cowardice and egotism versus heroism and self-sacrifice and more.  
1,A mature subtle script that suggests and occasionally brings into dramatic focus the underlying tensions is well served by perfect performances (apart from the odd inappropriate smiling that Keira Knightley is prone to though perhaps under direction this time as the other characters themselves often mention it).  
1,But above all the exquisite visual composition of each moment with inventive and elegant use of close-up camera angle and lighting including pointillistic faux home movie footage is a wonder and joy to behold.  
1,It's as continuously beautiful to look at as a Bertolucci but the relationships here are more convincing and the narrative more engaging than some of that master's work.  
0,The basic premise is wasted since it is sidelined by the inexplicable focus on the documentary crew.  
0,Regardless the film fails on most levels.  
0,Avoid at all costs.  
1,I saw this film over Christmas and what a great film it was!  
1,I thought Errol Flynn was brilliant as Custer and has since become my favourite actor!  
1,His acting alongside Olivia De Havilland was brilliant and the ending was fantastic!  
1,I had always known that Errol Flynn was a brilliant actor as he was my dads favourite actor and I grew up watching his films as a child.  
1,But it wasn't until I watched this film that I realised how great he actually was.  
1,I'll give this film 10 out of 10!  
0,I know that Jim O'Connor was very energetic and that nobody could be as much as him but George was well dull.  
0,He really didn't seem to want to be hosting; his voice-overs were monotonous didn't get involved with the guests.  
1,Lovely little thriller from Hitchcock with lots of nice shenanigans surrounding a murdered spy a kidnapped child a nasty church a foreign plot and some random taxidermists.  
1,Jimmy Stewart is as ever a great hero for Hitchcock the story rips along to its cool climax at an embassy function but it lacks the brooding menace of Hitchcock's black and white low-budget original.  
1,Nevertheless yet another wonderful film from the great master's stable.  
1,I have to say that this film was excellently produced and tops the ratings as a typical sci fi film!  
1,Excellently produced by one of Sci-fi's best producers Scot Vandiver !  
1,But it is entertaining nonetheless.  
1,It's a campy sort of film that's a joy to watch.  
1,There's barely a boring moment in the film and there are plenty of humorous parts.  
1,The cast is always entertaining as usual.  
1,Overall a delight!  
0,This movie is so mind-bendingly awful it couldn't have even been created.  
0,The film lacks any real scares or tension & some of the medical terminology used throughout is a bit iffy to say the least & I say that as an insulin dependant diabetic myself.  
0,The least said about the acting the better.  
1,This movie does an excellent job of revealing the complexity of the task and the incredible challenges facing South Africa.  
1,I believe every one should see this movie as I think few people outside of South Africa understand its past and what is being attempted in the Truth and Reconciliation process.  
1,Nothing short of magnificent photography/cinematography in this film.  
1,The acting is fantastic the stories are seamlessly woven together and the dogs are splendid............. A must rent view or see.  
1,Don't be afraid of subtitles........ its worth a little aversion therapy 10/10  
1,Excellent performance.  
1,There still are good actors around!  
1,Also great directing and photography.  
1,Very true to Shakespear and a 'must' for all Shakespear fans.  
1,Macbeth (Jason Connery) moved me to tears with his final monolog (out brief candle out)He gave the sphere of moral decay and dark forces a human face which makes it the more interesting.  
1,Helen Baxendale is a very credible lady Macbeth who can be very cheerfull at times and sometimes she just looks like a naughty girl but deadly in her taste for blood and evil.  
1,If you love death and decay and Shakespears lyrics... this is the one.  
1,This is a witty and delightful adaptation of the Dr Seuss book brilliantly animated by UPA's finest and thoroughly deserving of its Academy Award.  
1,Special mention should be made of the superb music score and sound effects which are an integral element in helping to make this such a memorable and enjoyable cartoon.  
1,"However Paul Schrader has indeed made a film ""about"" Mishima that is both superb & complex.  "
1,Also notable is John Bailey's fine crisp beautifully colored cinematography and the great production design & costumes by Eiko Ishioka who went on to do the memorable costumes for Coppola's Dracula for which she received a well deserved Oscar.  
0,Even allowing for poor production values for the time (1971) and the format (some kind of mini-series) this is baaaaaad.  
0,"Unless you're just out to visually ""collect"" all extant films of Austen's work you can skip this one.  "
1,If you do watch it however there are small consolations: The actresses playing Anne's sisters each do a wonderful job with their roles.  
0,It is not good.  
0,Speaking of the music it is unbearably predictably and kitchy.  
0,Then the film just dropped the ball.  
1,This is a stunning movie.  
1,Raw and sublimely moving.  
1,It felt like a very gripping intelligent stage play (but without the overly theatrical feeling one actually gets from watching people on a stage) which plays on everyone's terror of a white lie escalating to monstrous consequences.  
1,All of the main players are mesmerising.  
1,Tom Wilkinson broke my heart at the end... and everyone else's judging by the amount of fumbling for hankies and hands going up to faces among males and females alike.  
1,Julian Fellowes has triumphed again.  
1,He's a national treasure.  
1,GO AND SEE IT!  
1,This is an excellent film.  
1,The aerial scenes were well-done.  
1,It was also the right balance of war and love.  
1,"The film gives meaning to the phrase ""Never in the history of human conflict has so much been owed by so many to so few.  "
1,Kris Kristoffersen is good in this movie and really makes a difference.  
1,A good film by a great director!  
1,This is definitely one of the better documentaries I have seen looking at family relationships and marriage.  
0,There are many continuity errors: one other user commented on different cars in the garage Joe's glasses...the one that got to me the most was the fact Joe's facial hair configuration seemed to change from scene to scene.  
1,This is just a great movie.  
1,10 out of 10 stars.  
0,I can't see how this movie can be an inspiration to anyone to come out or overcome fear and rejection.  
0,It's so bad it's actually worth seeing just for that reason.  
1,Punishment Park is a brilliant piece of cinema.  
1,Shot in the Southern California desert using his patent faux documentary style Watkins creates a film like no other.  
1,This is one of Peter Watkins most accessible films.  
1,I advise you to look out for it.  
1,You wont regret it!  
1,Highly recommended A+  
0,Well... Just if you keep thinking how bad it is.  
0,It's a mediocre miserable hollow laughable and predictable piece of garbage.  
0,It's a case of 'so bad it is laughable'.  
0,) very bad performance plays Angela Bennett a computer expert who is at home all the time.  
0,It is a film about nothing just a pretext to show ridiculous action scenes.  
0,How awful she is!  
0,But she is still a bad actress repeating her robotic face moves in each of her pictures.  
0,The results well are a shame.  
0,DELETE this film from your mind!  
0,One of the worst shows of all time.  
0,The show would begin with smart ass ed comments to each other that would be totally off the wall and uncalled for.  
0,The fat computer geek was unbelievable the bible thumper the bad-ass girl who are these actors???  
0,Never heard of any of them except Cole who was totally unbelievable in the part.  
0,"Every time he opened his mouth you expect to hear ""you see kids..."" Pulling the plug was a mercy killing for this horrible show.  "
0,The stories were as unbelievable as the actors.  
0,Lame would be the best way to describe it.  
1,Stanwyck and Morgan are perfectly cast in what is in many ways a modern equivalent of Dickens' Christmas Carol in its sensibility.  
1,The success of the film depends on the casting of Sydney Greenstreet as the Alexander Yardley character.  
1,The attractive set used throughout most of the film is an eye-pleasing gem.  
0,Im big fan of RPG games too but this movie its a disgrace to any self-respecting RPGer there is.  
0,The lines the cuts the audio everything is wrong.  
0,You can find better movies at youtube.  
0,Top line: Don't waste your time and money on this one its as bad as it comes.  
0,"A Lassie movie which should have been ""put to sleep"".... FOREVER.  "
0,That's how I'd describe this painfully dreary time-waster of a film.  
0,So mediocre in every aspect that it just becomes a dull uninteresting mess this is one of the most forgettable movies I've seen.  
0,"It isn't even an achievement as a ""so-bad-it's-good"" or ""so-bad-it's-memorable"" movie.  "
0,It's an empty hollow shell of a movie.  
0,Seriously it's not worth wasting your or your kid's time on.  
0,Avoid avoid avoid!  
0,It will drive you barking mad!  
1,The transfers are very good.  
1,Very nice and relaxing late night viewing.  
1,The movie is full of wonderful dancing (hence the title!  
1,) some great music and terrific scenery.  
1,It handles some tough issues with dignity and grace and of course has (shocking spoiler here!  
1,) a happy wonderful feel good ending!  
1,The point is the journey a journey that touches every member of the family.  
1,It's one of the movies I need to see whenever it comes on TV...never mind the fact that I already have it memorized!  
0,Nothing new there.  
0,That was done in the second movie.  
0,The movie has almost no action scenes in it and very little comedy.  
0,The plot has more holes than a pair of fishnet stockings and the direction and editing is astonishingly ham fisted.  
0,What on earth is Irons doing in this film?  
1,I just saw this film and I recommend it.  
1,It has a very good plot it holds your complete attention the acting is superb Tom Wilkinson was fantastic and Emily Watson was also very good.  
1,A very good film indeed about great and unconditional love.  
1,Tom Wilkinson's character is a man who is not prepared for the ordeal that is about to begin but he takes the matter in hand as the story progresses and this great actor gives a performance that makes you feel the character's anguish and suffering.  
1,Emily Watson's character is very strong and she has only to give a quick glance and you understand everything.  
1,Despite the pans of reviewers I liked this movie.  
1,In fact I liked it better than Interview With a Vampire and I liked this Lestat (Stuart Townsend) better than Cruise's attempt.  
1,Aailiyah was pretty good as Akasha in places compelling (her first entrance and mini dance scene).  
1,I'm a big fan of this series mostly due to Anne Rice's style sensitivities and treatments.  
1,I guess I liked the details of his dysfunction--he was believable.  
0,The football scenes at the end were perplexing.  
1,But I thought his acting was skilled.  
1,Meredith M was better than all right.  
1,A very charming film with wonderful sentiment and heart.  
1,It is rare when a film-maker takes the time to tell a worthy moral tale with care and love that doesn't fall into the trap of being overly syrupy or over indulgent.  
1,Nine out of ten for a truly lovely film.  
1,This early film from future goremeister Lucio Fulci is a very good addition to the giallo sub-genre.  
1,This is one of the best Italian thrillers of the early 70's.  
1,A standout scene.  
0,This scene is very strong and unpleasant.  
0,Technically the film is well made with impressive camera-work solid acting and effective music from Riz Ortolani  particularly good is a recurring unaccompanied female vocal that sounds like it's coming from a distant hill.  
1,It's still wild stuff though and is highly recommended to fans of giallo cinema.  
1,The movie was very interesting from beginning to the end.  
1,I liked the way Dustin Hoffman's character was ready to do just about everything to stay with his son.  
1,This movie is also revealing.  
1,Personally I think it shows that people should learn to find a compromise them self without involving other people into issue.  
0,And it was boring.  
0,I am so tired of clichés that is just lazy writing and here they come in thick and fast.  
1,PS the only scene in the movie that was cool is when the central character finds her room blown up.  
1,It's a fresh subtle and rather sublime effect.  
1,"An Italian reviewer called this ""a small great film"" and that's right.  "
1,All the actors give a wonderful performance especially Jennifer Rubin as Jamie Harris who changes from the nervous starlet in the beginning through the strange events she is part of to the cool star.  
1,You learn a lot about the real inside emotions of people in this movie and a lot about the movie business itself.  
1,"The movie in movie situations in the beginning and through the game that is played with her by the ""acting coach"" are fascinating.  "
1,Also the music by Mark Snow is possibly the best score I've ever heard.  
1,You won't forget this movie!  
0,Why was this film made?  
0,The film has an ultra-cheap look to it.  
0,The result is a film that just don't look right.  
0,None of them are engaging or exciting.  
0,The plot is nonsense that doesn't interest in the slightest way or have any uniqueness to it.  
0,The Foreigner is not worth one second of your time.  
1,"I saw it as a child on TV back in 1973 when it was ""The Stranger"" and I loved it.  "
1,But the duet between the astronaut and his doctor at the beginning of the movie is a perfect exchange if one considers that this movie was made well into the Cold War and the astronaut's biggest fear is that he has crashed in the USSR.  
1,This movie is so awesome!  
1,I loved it it was really scary.  
1,I love the Scream movies and all horror movies and this one ranks way up there.  
1,If you want a real scare rent this one!  
1,This is an extraordinary film.  
1,As a courtroom drama it's compelling as an indictment on the American justice system it's frightening.  
1,This film highlights the fundamental flaws of the legal process that it's not about discovering guilt or innocence but rather is about who presents better in court.  
1,The film is well paced understated and one of the best courtroom documentaries I've seen.  
1,This mostly routine fact-based TV drama gets a boost from the fine performance by Cole.  
1,Predictable but not a bad watch.  
1,It was clear that she had the range and ability to pull off this part.  
1,She carries the movie well.  
